{
  "$schema": "http://json-schema.org/draft-04/schema#",
  "$id": "https://raw.githubusercontent.com/umccr/orcabus/main/docs/schemas/events/sequencerunmanager/SequenceRunLibraryLinkingUpdate.schema.json",
  "description": "EventBridge custom event schema for orcabus.sequencerunmanager@SequenceRunLibraryLinkingUpdate",
  "title": "AWSEvent",
  "definitions": {
    "SequenceRunLibraryLinkingUpdate": {
      "type": "object",
      "required": ["instrumentRunId", "sequenceRunId", "timeStamp", "linkedLibraries"],
      "properties": {
        "id": {
          "type": "string"
        },
        "version": {
          "type": "string"
        },
        "instrumentRunId": {
          "type": "string"
        },
        "sequenceRunId": {
          "type": "string"
        },
        "timeStamp": {
          "type": "string",
          "format": "date-time"
        },
        "linkedLibraries": {
          "type": "array",
          "items": {
            "type": "string"
          }
        }
      }
    }
  },
  "type": "object",
  "properties": {
    "id": {
      "type": "string"
    },
    "region": {
      "type": "string"
    },
    "resources": {
      "type": "array",
      "items": {
        "type": "string"
      }
    },
    "source": {
      "type": "string"
    },
    "time": {
      "format": "date-time",
      "type": "string"
    },
    "version": {
      "type": "string"
    },
    "account": {
      "type": "string"
    },
    "detail-type": {
      "type": "string"
    },
    "detail": {
      "$ref": "#/definitions/SequenceRunLibraryLinkingUpdate"
    }
  },
  "required": ["detail", "detail-type", "source"]
}
