{
  "version": "0",
  "id": "12345678-90ab-cdef-1234-567890abcdef",
  "detail-type": "SequenceRunLibraryLinkingUpdate",
  "source": "anything except orcabus.sequencerunmanager e.g. orcabus.manual",
  "account": "000000000000",
  "time": "2025-03-01T00:00:00Z",
  "region": "ap-southeast-2",
  "resources": [],
  "detail": {
    "id": "5ec963c26aa70134cc5ee3c875feea56",
    "version": "1.0.0",
    "instrumentRunId": "123456_A7890_1234_ABCDEFGH",
    "sequenceRunId": "r.1234567890abcdefghijklmn",
    "timeStamp": "2025-03-01T00:00:00.000000Z",
    "linkedLibraries": ["L2000000", "L2000001", "L2000002", "L2000003"]
  }
}
